{
  "event_id": "6083feb1-75b0-d074-c838-55cc7c775045",
  "event_type": "projection.notification",
  "schema_version": 1,
  "occurred_at": "2026-09-24T12:00:00.123456Z",
  "tenant_id": "11111111-1111-4111-8111-111111111111",
  "aggregate_type": "projection_notification",
  "aggregate_id": "33333333-3333-4333-8333-333333333333",
  "aggregate_version": "7",
  "correlation_id": "44444444-4444-4444-8444-444444444444",
  "causation_id": "22222222-2222-4222-8222-222222222222",
  "traceparent": "00-0af7651916cd43dd8448eb211c80319c-b7ad6b7169203331-01",
  "payload": {
    "notification_id": "22222222-2222-4222-8222-222222222222",
    "resource_type": "device",
    "resource_id": "33333333-3333-4333-8333-333333333333",
    "purpose": "projection_changed",
    "scope": "tenant",
    "source_event_id": "22222222-2222-4222-8222-222222222222",
    "source_event_type": "device.status_changed",
    "source_version": "7",
    "projected_at": "2026-09-24T12:00:00.123456Z"
  }
}
